serial no,title,link,author
14_03_2024_1,Trump 2.0 will see Deep State revamp; foreign policy may get unpredictable,https://drive.google.com/file/d/1Ytz1rQhKqbovGfLgOQ5Cko4HTKNr93nu/view?usp=drivesdk,"[""Maleeha Lodhi""]"
14_03_2024_2,"After CAA rules, contours of confrontation changing",https://drive.google.com/file/d/1FQ7_nniZRqp_RUt6piJkb7jNnxLzsX8C/view?usp=drivesdk,"[""Shikha Mukerjee""]"
14_03_2024_3,Google's bad Gemini rollout did us all a favour,https://drive.google.com/file/d/1UPlwmAbtrsRRfT_V6Tr8Vrnviyq1qMxA/view?usp=drivesdk,"[""Clive Crook""]"
14_03_2024_4,China's military ambitions,https://drive.google.com/file/d/1NdPUY2JxjS_G_FkmB0jnsZk_WLTiExhB/view?usp=drivesdk,"[""Harsh V Pant"", ""Kalpit Mankikar""]"
14_03_2024_5,The menace of paper leaks and cheating,https://drive.google.com/file/d/1pYHT01FcMokFwlg8BD7NnpeeGGisbzLh/view?usp=drivesdk,"[""J S Rajput""]"
14_03_2024_6,RUSA and PM-USHA: making higher education future ready,https://drive.google.com/file/d/1uUAUbIxYbb_aLC1K_OzVsaAQPtMV3Lnw/view?usp=drivesdk,"[""Raghavendra P Tiwari""]"
14_03_2024_7,AI is revolutionising waste management,https://drive.google.com/file/d/1pP7iaIQHR4Oft549OQvPo0KHzdhLfJJ_/view?usp=drivesdk,"[""Uttam Chakraborty""]"
14_03_2024_8,Hidden costs,https://drive.google.com/file/d/1AGsxIWBLMO5fO7mAlMvvL62uHecBW-1N/view?usp=drivesdk,"[""Jaydev Jana""]"
14_03_2024_9,Busting myths about CAA,https://drive.google.com/file/d/14NjB_jyIstLiaYSm-lnYlTAfd_ZawhDw/view?usp=drivesdk,"[""Kushank Sindhu""]"
14_03_2024_10,Bengaluru's water crisis may reflect an even larger one ,https://drive.google.com/file/d/1YCLC-EFUue9UPQZ1_OjIz_wCO7dnBxF1/view?usp=drivesdk,"[""Rahul Jacob""]"
14_03_2024_11,Agni-5 trial: a blast-off for superior deterrence,https://drive.google.com/file/d/1DT4SDzGrIgVzVriM8EMYlseRNZmeK8AF/view?usp=drivesdk,"[""Anonymous""]"
14_03_2024_12,We could make up for the covid disruption of schooling if we try,https://drive.google.com/file/d/17cWemwZbHc4GmgKjDq4s76v4QvGaAgzL/view?usp=drivesdk,"[""Anurag Behar""]"
14_03_2024_13,Multiple narratives need not cloud the WTO's agenda,https://drive.google.com/file/d/1QpczmhXvJqPhJUK2szfsW_17JDha0fkm/view?usp=drivesdk,"[""R V Anuradha""]"
14_03_2024_14,Solar energy success may be a curse for China's panel makers,https://drive.google.com/file/d/1qmbxmTAgeW0A-hbDDAGPmLoW__ztFwVo/view?usp=drivesdk,"[""David Fickling"", ""Tim Culpan""]"
14_03_2024_15,India should prepare itself for a dynamic employment scenario,https://drive.google.com/file/d/1j27pkFkwzcuKh9A2YmnVF8SCoMBGuUNr/view?usp=drivesdk,"[""Amit Kapoor"", ""Shivani Kowadkar""]"
14_03_2024_16,Speak in many tongues,https://drive.google.com/file/d/10q9IWpC2_Nj_8huovlHVjfYxUPt8m5-0/view?usp=drivesdk,"[""Gauri Puranik""]"
14_03_2024_17,Joined by the Vindhyas,https://drive.google.com/file/d/1xQONvggFS69tuX95uGCRu9rXqGzaD975/view?usp=drivesdk,"[""Swaminathan S Anklesaria Aiyar""]"
14_03_2024_18,Healthcare policies post-2014 India: achievements and prospects,https://drive.google.com/file/d/1mzXGz_i-3PxqXJmqWE1EVfY4GPXrHMx8/view?usp=drivesdk,"[""Parthiv N Mehta"", ""Alok Virendra Tiwari""]"
14_03_2024_19,"To survive, India must shun hate",https://drive.google.com/file/d/1xAs8Si1Pitc0p2_KnI3tLbhmQ8Ncphh8/view?usp=drivesdk,"[""Ashutosh""]"
14_03_2024_20,Catching the sunshine,https://drive.google.com/file/d/1xz9MvI7DBPL25ZjdYvcol3JSeT0xJOc5/view?usp=drivesdk,"[""Arunabha Ghosh"", ""Neeraj Kuldeep""]"
14_03_2024_21,International footprint,https://drive.google.com/file/d/1vzs-MdzIo4YB7yTBo-dKdbTUBrUaV3cz/view?usp=drivesdk,"[""Anil Swarup""]"
14_03_2024_22,War mindset,https://drive.google.com/file/d/1WWd1uTUnvb9KIcZDLXALqmMkXapp6gfg/view?usp=drivesdk,"[""Aditi Singh""]"
14_03_2024_23,Cities don't have to sink in waste,https://drive.google.com/file/d/1p-wLbp0tycownrVmEtzFiYq7iiHlwXq3/view?usp=drivesdk,"[""Amit Kapoor"", ""Bibek Debroy""]"
14_03_2024_24,Kudos to Mint Street mandarins,https://drive.google.com/file/d/1AFQR-paoK8Hh9jfDvSsGOgDoTI9I4iMn/view?usp=drivesdk,"[""Ajay Chhibber""]"
14_03_2024_25,"Earth, Mars and climate",https://drive.google.com/file/d/1WLDJ7VlP0Xyy-OZVnbNchdFtF-Y7cdQm/view?usp=drivesdk,"[""Adriana Dutkiewicz"", ""Dietmar Muller""]"
14_03_2024_26,Healthy atmosphere a prerequisite for development,https://drive.google.com/file/d/1bOjtPxHqHnET_FyI_9vOhLKYgu60sui9/view?usp=drivesdk,"[""Mohan Kanda""]"
14_03_2024_27,"The Karnataka civil engineers Bill, its pathway",https://drive.google.com/file/d/1U7_CwGuBtSnklSfhNBgGDYxfTQhuq6x-/view?usp=drivesdk,"[""A Srivathsan""]"
14_03_2024_28,"India's research and development funding, breaking down the numbers",https://drive.google.com/file/d/1RdFRDurNlBgu-YL9rIpYaNUEh0qxHjPv/view?usp=drivesdk,"[""Animesh Jain"", ""Anurag Anand""]"
14_03_2024_29,Russian dominance in India's arms imports declines,https://drive.google.com/file/d/1tc3Vel1XvDmBUZHU5irpzSbnr7oNGD0i/view?usp=drivesdk,"[""Anonymous""]"
14_03_2024_30,"Higher engagement, better learning",https://drive.google.com/file/d/15b1mR5J8JerdPzjWosksbHjEpzGjbneZ/view?usp=drivesdk,"[""Urmila Chowdhury""]"
14_03_2024_31,How did Indians end up in the Russia-Ukraine war?,https://drive.google.com/file/d/19LOgKuMSkekYUW9iLEyP7-NRxpHZEPuP/view?usp=drivesdk,"[""Sumeda""]"
14_03_2024_32,On judges and bureaucrats joining politics,https://drive.google.com/file/d/1qembxJVO0wObIrtcSeCSsUQ5KYoOrmjd/view?usp=drivesdk,"[""Rangarajan R""]"
14_03_2024_33,From the frontlines: what we see when we look at suffering,https://drive.google.com/file/d/1jfc6WTTcLHMqDCGYTY4A3kpmhW--HFJL/view?usp=drivesdk,"[""Jonathan Koshy Varghese""]"
14_03_2024_34,Nari Shakti in Economics: Will it make a difference?,https://drive.google.com/file/d/1WCRO-DBWYsL3-haqT_u8TlzYFCv7Ka27/view?usp=drivesdk,"[""T C A Srinivasa Raghavan""]"
14_03_2024_35,EFTA deal and the Swiss challenge,https://drive.google.com/file/d/1vdUCmwVHprYAkOw2s-bEK55l4VtpM_z8/view?usp=drivesdk,"[""Sangeeta Godbole""]"
14_03_2024_36,A case for disaster risk financing in States,https://drive.google.com/file/d/1OIKE8WcWrg63nUOT3HWnPGlSr_CEa5oT/view?usp=drivesdk,"[""Cyril Shroff"", ""Arjun Goswami""]"
14_03_2024_37,Reality check on consumption trends,https://drive.google.com/file/d/1HS_WtR4lnXRV8Fkx2-EvvQVxFc0f_sY_/view?usp=drivesdk,"[""Saugata Bhattacharya""]"
14_03_2024_38,Small biz acquisition,https://drive.google.com/file/d/1C426KG8TGupspAcNuaEmPl961ggVucv0/view?usp=drivesdk,"[""Tarun Soneja""]"
14_03_2024_39,India's jets with India's jet engines? Tough ask,https://drive.google.com/file/d/1jikVvxI2o5KiY2c3HzPofSMkhD-f0nG8/view?usp=drivesdk,"[""Rudroneel Ghosh""]"
14_03_2024_40,"GoI, Bitcoins are jingling",https://drive.google.com/file/d/12I8sFWRf1rwd5c5w0LdTnCnE7fi9N-5h/view?usp=drivesdk,"[""Ruchir Sharma""]"
14_03_2024_41,The suitable citizen,https://drive.google.com/file/d/1iWFtWzZ8eLflZw8c37KRgAlpYDu9KhuA/view?usp=drivesdk,"[""Pratap Bhanu Mehta""]"
14_03_2024_42,The Court's trajectory,https://drive.google.com/file/d/1WdqIv30um28U7RkBqJrpci2R4d_P9s1_/view?usp=drivesdk,"[""Christophe Jaffrelot""]"
14_03_2024_43,"A fact sheet, a sheet anchor",https://drive.google.com/file/d/1htldwUWGzUm5X-UfYQcxsk5s3EX3oo8h/view?usp=drivesdk,"[""Bibek Debroy""]"
14_03_2024_44,When Mumbai was Bombay,https://drive.google.com/file/d/1zKXmKkneHUq1NZhcfo2YmRV_rCzi7I3G/view?usp=drivesdk,"[""Coomi Kapoor""]"
14_03_2024_45,Pi day: understanding the world's most famous mathematical constant,https://drive.google.com/file/d/1NCmTfTUbIvL8GzeoLgUy-bbxNu-rwEUo/view?usp=drivesdk,"[""Arjun Sengupta""]"
14_03_2024_46,FBR and energy security,https://drive.google.com/file/d/1ceaCYlVnPxcZu2qUXDCInh4IacceedJ8/view?usp=drivesdk,"[""Anil Sasi""]"
14_03_2024_47,The `first autonomous' AI software engineer: meet Devin,https://drive.google.com/file/d/17uEgHSGBp2xeL_pc-xmh9JrA7oOG4wnm/view?usp=drivesdk,"[""Bijin Jose""]"
14_03_2024_48,"The froth in small stocks, and why regulators are worried",https://drive.google.com/file/d/1caLsAxp4azUWb5wFDrMkpWn25nDBIUaA/view?usp=drivesdk,"[""Hitesh Vyas"", ""George Mathew""]"
14_03_2024_49,Global water crises need radical rethink,https://drive.google.com/file/d/1yP7HBfxFZ7Mt8rR6eqvxqfNfsSd2ZZL-/view?usp=drivesdk,"[""C P Rajendran""]"
14_03_2024_50,Lessons for the big fight from two small upsets,https://drive.google.com/file/d/1eVbInwRojcTy32JhR39TcoegsYwyaf4y/view?usp=drivesdk,"[""K P Nayar""]"
14_03_2024_51,India needs more pacts to boost exports,https://drive.google.com/file/d/1c0r0E15iHpqoTuWfxCtat3u6BU8uGYl9/view?usp=drivesdk,"[""Sushma Ramachandran""]"
14_03_2024_52,A strategic handshake with Dragon would be in mutual interest,https://drive.google.com/file/d/14QiGhd5uLDdv2Hu9uj6VjDa7JjhypndM/view?usp=drivesdk,"[""Pradeep Bali""]"
14_03_2024_53,How coalition politics impacts electoral prospects,https://drive.google.com/file/d/1OIbf7uzFjc8DBlyKQY_2wRBLO8O1deqd/view?usp=drivesdk,"[""Atanu Biswas""]"
14_03_2024_54,"Developing Chhattisgarh, doubling GSDP in 5 years",https://drive.google.com/file/d/1Q5WsvxBXs8vJ-G2DRlYVAp7aNTzeygwU/view?usp=drivesdk,"[""Vishnu Deo Sai""]"
14_03_2024_55,"Stalemate in Ukraine, NATO in expansion",https://drive.google.com/file/d/1C9ieWYJW4eKErXL2BDaa7uAEpb9aAEG2/view?usp=drivesdk,"[""Manoj Joshi""]"
14_03_2024_56,The citizenship act and its discontents,https://drive.google.com/file/d/1x9Y5mAN7gTTTcsNXI9nBsXeLl0gT5Bwo/view?usp=drivesdk,"[""Suhrith Parthasarathy""]"
15_03_2024_1,Holding up half the sky,https://drive.google.com/file/d/1zXCI_9JRGDJ852q05Y2om_wf63dKH0se/view?usp=drivesdk,"[""Akhilesh Tilotia""]"
15_03_2024_2,Family entrepreneurs' rise and fall,https://drive.google.com/file/d/1UIMoCmHHrFnTHo8tLH6k4h1kmaTgLcoy/view?usp=drivesdk,"[""Kavil Ramachandran""]"
15_03_2024_3,Systemic change: bureaucrats now getting a longer and stabler tenure,https://drive.google.com/file/d/13bqc55dp8uableFxXY_p2k0LwTZhIcou/view?usp=drivesdk,"[""Dilip Cherian""]"
15_03_2024_4,Dalai Lama has ensured global identity for Tibet,https://drive.google.com/file/d/1er2XePlgdCnCv6CL6pmP0tGjnMCpW2fu/view?usp=drivesdk,"[""Sunanda K Datta-Ray""]"
15_03_2024_5,Scientists play a key role in a nation's progress,https://drive.google.com/file/d/1K1MvqBThI43S7pM9YPfCSjywl08q6HcD/view?usp=drivesdk,"[""Biju Dharmapalan""]"
15_03_2024_6,Remembering Johan Galtung: a pioneer in peace research,https://drive.google.com/file/d/1HTulCicOlCyaT4mHBcy7TuWwfA3qGkIq/view?usp=drivesdk,"[""Rajdeep Pathak""]"
15_03_2024_7,"India, Mauritius forge strategic ties",https://drive.google.com/file/d/1U_xGPCdcjqgI86i86R25kSlXM2FG2dAB/view?usp=drivesdk,"[""Sudhir Hindwan""]"
15_03_2024_8,Ethanol ambitions,https://drive.google.com/file/d/1CupYQdW-RT3yQmfcDJd-HJ00eGFC5b5R/view?usp=drivesdk,"[""J P Gupta""]"
15_03_2024_9,As giants compete for Indian Ocean space,https://drive.google.com/file/d/17yfcWSZ_BnAvm2GwAlT4rXe5nI0mP4wy/view?usp=drivesdk,"[""Smruti S Pattanaik""]"
15_03_2024_10,Urgent need to tackle perils of intoxication,https://drive.google.com/file/d/1iEC1cNFJKMXgskz60UfNRgQ7prfv0-F1/view?usp=drivesdk,"[""Bharat Dogra""]"
15_03_2024_11,EV proliferation could make carbon reduction harder,https://drive.google.com/file/d/1wwPZ36yxlU0YUM4pSg6Wy9aFWrDbNwco/view?usp=drivesdk,"[""Ajit Ranade""]"
15_03_2024_12,Celebrating happiness: are we all so unhappy?,https://drive.google.com/file/d/1_IpAlPNAV3X4hdaNfSlUHm0RQZNZtz0C/view?usp=drivesdk,"[""Anonymous""]"
15_03_2024_13,We'll learn to be more human in the age of artificial intelligence,https://drive.google.com/file/d/19HlZuavfjFAZi8FV3y_N7V_BzxtFtyAu/view?usp=drivesdk,"[""Jaspreet Bindra""]"
15_03_2024_14,The fallacy of crypto as an alternative to fiat currency,https://drive.google.com/file/d/1cNseulvdzbyo2yb8JpTpmU2sLAiKPXTJ/view?usp=drivesdk,"[""Srinath Sridharan""]"
15_03_2024_15,OpenAI could win back lost trust by being less secretive,https://drive.google.com/file/d/1ASLAskJzn67fbFG1I367g4wPIsml9oM7/view?usp=drivesdk,"[""Parmy Olson""]"
15_03_2024_16,Two faces of free trade: help the one that fosters harmony prevail,https://drive.google.com/file/d/1pVBwxlk_KD2krNuhWCNLQFA75I2gpuud/view?usp=drivesdk,"[""Dani Rodrik""]"
15_03_2024_17,Embracing `Make Products in India',https://drive.google.com/file/d/1ISakw7QGqARoHJXNbYotlL8bAukZF-Hx/view?usp=drivesdk,"[""Ajay Kumar""]"
15_03_2024_18,Pharma regulation: a complex problem,https://drive.google.com/file/d/1oRE3oFBCrq04ujUw6gNJR_Y799OYVBZU/view?usp=drivesdk,"[""K P Krishnan""]"
15_03_2024_19,Beyond the BSP,https://drive.google.com/file/d/1e9KTiFGcGHmcKYOUnhgYgdQPpzDWD2A3/view?usp=drivesdk,"[""Aditi Narayani Paswan""]"
15_03_2024_20,No going back to square one,https://drive.google.com/file/d/1R1gAcbCq3vrjyJhhFqZei6fxbVfFYDaG/view?usp=drivesdk,"[""S Y Quraishi""]"
15_03_2024_21,Super election year,https://drive.google.com/file/d/1ZRppGl35SyDSqrEDuXJr1ryClId-AuxN/view?usp=drivesdk,"[""Derek O'Brien""]"
15_03_2024_22,Open minds before open books,https://drive.google.com/file/d/1d8gUyZDkzH9okhzlrWUcKpqf0zYeDRkJ/view?usp=drivesdk,"[""Amit Kaushik""]"
15_03_2024_23,Classroom is ready for change,https://drive.google.com/file/d/1UK8lwLdiZjz7kqEUi5ms9gzYJQf0O06s/view?usp=drivesdk,"[""Radhey Shyam Sharma""]"
15_03_2024_24,Ratification by states: what it will take to make panel view legally tenable,https://drive.google.com/file/d/1dSScDFQBpC0BosX9UYuAFiDws6PmMZhq/view?usp=drivesdk,"[""Apurva Vishwanath""]"
15_03_2024_25,Unpacking Kovind panel's report,https://drive.google.com/file/d/1dWAoXjz6KawjUFMfR10OxUtGOvddg6Gt/view?usp=drivesdk,"[""Ajoy Sinha Karpuram"", ""Arjun Sengupta"", ""Vikas Pathak""]"
15_03_2024_26,"Bhutan's opening move, its Gelephu gambit",https://drive.google.com/file/d/1Rek0ixvy7F-MAP4UHBAOWcnbsxRNLJN2/view?usp=drivesdk,"[""Suhasini Haidar""]"
15_03_2024_27,"In issuing AI advisory, MEITY becomes a deity",https://drive.google.com/file/d/1JKAcdjl7Tlv-c9CEOxFrzAt9FHDD20UY/view?usp=drivesdk,"[""Apar Gupta""]"
15_03_2024_28,Has poverty really dropped to 5 percent in India?,https://drive.google.com/file/d/1esmF6V7pPJkZEuavkHZo9xhsyG9L7yrj/view?usp=drivesdk,"[""Surjit Bhalla"", ""Jayati Ghosh""]"
15_03_2024_29,What are the causes of the flare-up in eastern Congo?,https://drive.google.com/file/d/1RhIyR7s5jJ-DOfJJpwRsmuxA80embyoX/view?usp=drivesdk,"[""Sumeda""]"
15_03_2024_30,CAA and status of judicial proceedings,https://drive.google.com/file/d/1hnJxXa1r22FqRmye0LNZSnZeJLrHHyXO/view?usp=drivesdk,"[""Aaratrika Bhaumik""]"
15_03_2024_31,Now playing politics: Bollywood movies goes into poll mode,https://drive.google.com/file/d/1WRlI2YBF857oShsiE_Bl2Z64J167nQhI/view?usp=drivesdk,"[""Anuj Kumar""]"
15_03_2024_32,Digital competition law: implications for big tech,https://drive.google.com/file/d/1HCyP4q76ect90U5Y2G4U_cNADesTVcd8/view?usp=drivesdk,"[""K R Srivats""]"
15_03_2024_33,Capex or human development?,https://drive.google.com/file/d/1RbUNK9Q3ZeqovCQGpmkOG-Y27coxnTyv/view?usp=drivesdk,"[""Amarjeet Sinha""]"
15_03_2024_34,How India can address climate extremes,https://drive.google.com/file/d/1-QpqOFnSGZrT6Yr_M3Qmzgo4A5VfD-Y7/view?usp=drivesdk,"[""Abinash Mohanty""]"
15_03_2024_35,The dip in pvt medical colleges,https://drive.google.com/file/d/1QHFc8BJr2ODV-E4KcRlFiad8EQOHFYGv/view?usp=drivesdk,"[""Amrita Agarwal"", ""Khushboo Balani""]"
15_03_2024_36,Raising farmers' income,https://drive.google.com/file/d/1HsA_hFskUnFE7fslQ1C5l-Nhva5ltIYe/view?usp=drivesdk,"[""A Amarender Reddy"", ""Tulsi Lingareddy""]"
15_03_2024_37,Why NATO's new roles may be one too many,https://drive.google.com/file/d/1qvLPjHNhx-ZPYExBS6fUSpQtmyL6eScG/view?usp=drivesdk,"[""Tara Kartha""]"
15_03_2024_38,Assam's repeal of Muslim marriage law is a mistake,https://drive.google.com/file/d/1ZQIXszgod4RXlEZFuzA8l4LFayFWhrR1/view?usp=drivesdk,"[""Tahir Mahmood""]"
15_03_2024_39,Making sense of China's anti-corruption agenda,https://drive.google.com/file/d/1SH5TDWlNodAV_SSRm_ssMzaoWS691Fb4/view?usp=drivesdk,"[""Devendra Kumar"", ""Jabin T Jacob""]"
15_03_2024_40,Sauce for goose should be sauce for gander too,https://drive.google.com/file/d/1-SGtxyZ7Rb3EL-Zs1tUpqXDyhwnpqVIj/view?usp=drivesdk,"[""Bibek Debroy""]"
15_03_2024_41,"The why and the how of One Nation, One Election",https://drive.google.com/file/d/19-_ZvCTgaYOuKDVThloU1jU76bwWSaR_/view?usp=drivesdk,"[""Nandita Sengupta""]"
15_03_2024_42,`M' means `Minimum',https://drive.google.com/file/d/1SxX5U3H1IPZq9-e3FD1HZrzUAk3JTmwN/view?usp=drivesdk,"[""C Rangarajan"", ""S Mahendra Dev""]"
15_03_2024_43,Ujjwala burning bright?,https://drive.google.com/file/d/1hxmoEmR_WlUfKoFZh4iUM3YgHFZNDdF2/view?usp=drivesdk,"[""Neeraj Kaushal""]"
15_03_2024_44,To kill a mockingbot,https://drive.google.com/file/d/1H75FFAsiRVvMSggeoHDSIdmqbPHawpvk/view?usp=drivesdk,"[""Nikhil Pahwa""]"
15_03_2024_45,Giving the marginalised the gift of health,https://drive.google.com/file/d/130-PnBixE1G9cZsWx69dawVaNDFb4cN_/view?usp=drivesdk,"[""Julio Ribeiro""]"
15_03_2024_46,Secularism at stake,https://drive.google.com/file/d/1rpTC_vJeU8ELWpbmgzo9zz2heFFSneme/view?usp=drivesdk,"[""Vikas Singh""]"
15_03_2024_47,Pick-and-choose policy,https://drive.google.com/file/d/1g-0K07ieo6O2bFFkiMo5C-OiEN8tZiBs/view?usp=drivesdk,"[""Sanjoy Hazarika""]"
15_03_2024_48,Patient-doctor communication: a paradigm shift,https://drive.google.com/file/d/1xzftMu9EHqcxmW1pEbiPz2lswbyVsOka/view?usp=drivesdk,"[""Naresh Ahuja""]"
15_03_2024_49,Navigating the BRICS quantum challenge and preserving digital sovereignty,https://drive.google.com/file/d/1O-mCTxZhBhXdHaIRCWlOFwHnWRXlg-Yi/view?usp=drivesdk,"[""Sudhanshu Kumar"", ""Monojit Das""]"
15_03_2024_50,West Bengal's tryst with `outsiders',https://drive.google.com/file/d/1Z3ERi5vbj68TAz2nA-LfxqJYShu16sVF/view?usp=drivesdk,"[""Rasheed Kidwai""]"
15_03_2024_51,Landscape of Indian political parties,https://drive.google.com/file/d/1T5xIXu7JaELQYFjnK0kUlVBcuiOzxXcx/view?usp=drivesdk,"[""Anonymous""]"
15_03_2024_52,It's too late to China-proof the lithium supply chain,https://drive.google.com/file/d/1l2ktvOIqteBez27nGsPKPiB2UoTivi71/view?usp=drivesdk,"[""David Fickling""]"
16_03_2024_1,Indian Ocean tollgate tussle,https://drive.google.com/file/d/1QOi5SyNju4KT0keuXhtmBbUZ8155Ijpc/view?usp=drivesdk,"[""Dhananjay Tripathi""]"
16_03_2024_2,Looking East- I,https://drive.google.com/file/d/1Alf6K1nysM8bf9aJ2uAxeccGD0dkWiUZ/view?usp=drivesdk,"[""Rajaram Panda""]"
16_03_2024_3,Women vulnerable to alcohol abuse,https://drive.google.com/file/d/1pXrEkztZGExErw62bnRzORB3PeY4-CrD/view?usp=drivesdk,"[""Bharat Dogra""]"
16_03_2024_4,Can we place the bet on placements?,https://drive.google.com/file/d/1E4EUPUJ5yYybqGQrp2kCLzMZ2JY3liBv/view?usp=drivesdk,"[""Sahil Aggarwal"", ""Ravinder Pal Singh""]"
16_03_2024_5,India's infrastructure promise,https://drive.google.com/file/d/1L8wFBaxKcUra--0i1SLRA28KbQuBCXmb/view?usp=drivesdk,"[""Srinath Sridharan"", ""Sakate Khaitan""]"
16_03_2024_6,"All that glitters not growth, well-being for most Indians",https://drive.google.com/file/d/1U1RkaroHUGl7P2QKFTiVKMv6XS1Db1-9/view?usp=drivesdk,"[""Patralekha Chatterjee""]"
16_03_2024_7,Fifth-generation stealth jet to be a reality soon,https://drive.google.com/file/d/1f1sP9CtI7reSMTYMkmbUQo6iKvn83vEp/view?usp=drivesdk,"[""Rahul Kamble""]"
16_03_2024_8,"India is not a nation, but a subcontinent!",https://drive.google.com/file/d/1JUlgrtOORr3b75adoabL53BLXdJejMUp/view?usp=drivesdk,"[""Kumar Chellappan""]"
16_03_2024_9,Bridging the digital gap in rural Jammu and Kashmir,https://drive.google.com/file/d/1AnASujp3ZEMYYVmixH7kIGP-DNR2qXKT/view?usp=drivesdk,"[""Harish Kumar""]"
16_03_2024_10,The eventful centennial of Jimmy Carter,https://drive.google.com/file/d/1mzK2SxoRnVdqSQRpE5vqa-2-bRxqfBZv/view?usp=drivesdk,"[""Santosh Mathew""]"
16_03_2024_11,Social reform does not have to be political,https://drive.google.com/file/d/1msQa00OXkcD7IRLyTbF2mZwx_jSagMfv/view?usp=drivesdk,"[""Abhay Mokashi""]"
16_03_2024_12,EF TA can help boost India's global relevance,https://drive.google.com/file/d/1KX5yPgqV4B6iKoR-utpLgqARCED4AC97/view?usp=drivesdk,"[""Madan Sabnavis""]"
16_03_2024_13,Well-defined contours!,https://drive.google.com/file/d/1qTD67aO6EP3_WromhHJvRQ9_u6-0tSYR/view?usp=drivesdk,"[""Sandipani Dash""]"
16_03_2024_14,"No water, no joy",https://drive.google.com/file/d/1LnBQ3MQjICBYrnPTMZLwOLfanYUYXyqR/view?usp=drivesdk,"[""Shutapa Paul""]"
16_03_2024_15,Decoding vegetable inflation trends: A deep dive,https://drive.google.com/file/d/1C1mgI4fAsNZtiPR6RUslK4B11FDOGI0g/view?usp=drivesdk,"[""Vipin Malik"", ""Sankhanath Bandyopadhyay"", ""Athar Imam Raza""]"
16_03_2024_16,My body my choice: time to recognise this right all over the world,https://drive.google.com/file/d/1HU1nB0kEOnShkUtXoI0ZfYJdHQ6EyMjy/view?usp=drivesdk,"[""Pyali Chatterjee""]"
16_03_2024_17,From ballot papers to EVMs and NOTA,https://drive.google.com/file/d/1Fss8U3UKODuJA-5j6N1D4p_NqXqG4bEY/view?usp=drivesdk,"[""Anonymous""]"
16_03_2024_18,OCI status and CAA,https://drive.google.com/file/d/1xJP9pR_NS4Gd-zPweWNKItOmPipTFCVp/view?usp=drivesdk,"[""Moses Pinto""]"
16_03_2024_19,Let a thousand flowers bloom,https://drive.google.com/file/d/1a87sOi3W8pnVo6Zkxii5lCdkXcWldLNL/view?usp=drivesdk,"[""Kiran Somvanshi""]"
16_03_2024_20,Not all gold actually glitters,https://drive.google.com/file/d/1p5mnzAQZVCMcGplQt357QyL6oo7z7Ie5/view?usp=drivesdk,"[""Ajay Mathur""]"
16_03_2024_21,"Seduce HNIs, better India",https://drive.google.com/file/d/16_1E_apAgzp5BWFinrwlZVJyLxU9tDa0/view?usp=drivesdk,"[""Harsh Goenka""]"
16_03_2024_22,Fractured belonging,https://drive.google.com/file/d/1_4j_tjyRCeO-toL8aYZG7JK1FebbxZcy/view?usp=drivesdk,"[""Asim Ali""]"
16_03_2024_23,Ahmednagar to Ahilyanagar: the return of the native?,https://drive.google.com/file/d/1_o5FBUa8IsO-yoAvU8tkUerFfHDRBHLu/view?usp=drivesdk,"[""Manu S Pillai""]"
16_03_2024_24,"Five facts, five takeaways",https://drive.google.com/file/d/1Q17tKVvAfX9-pZdz96j1MZiaOYgHoO15/view?usp=drivesdk,"[""Trilochan Sastry""]"
16_03_2024_25,"One election, many problems",https://drive.google.com/file/d/1YxiApjDaTd7wR4ZcZ4ED3M4uO9mNkMVd/view?usp=drivesdk,"[""Manuraj Shunmugasundaram""]"
16_03_2024_26,The name is electoral bond,https://drive.google.com/file/d/1Tcd1XlsRo3QM1im-yrY75I-b9vkAcWb3/view?usp=drivesdk,"[""Jagdeep S Chhokar""]"
16_03_2024_27,"Act of inclusion, not exclusion",https://drive.google.com/file/d/1foB0tXsaFhrfToibvLvsC7MRChCsXgnd/view?usp=drivesdk,"[""Ram Madhav""]"
16_03_2024_28,Let's get back in sync,https://drive.google.com/file/d/1BG52uJ3HJGN6p8flRUbQcWqykgCt12ms/view?usp=drivesdk,"[""Sunil Arora""]"
16_03_2024_29,A penal code for AI,https://drive.google.com/file/d/1OUkhBjsWj0MVN5-WV_Nw8Lau5N0Ke5MN/view?usp=drivesdk,"[""Menaka Guruswamy""]"
16_03_2024_30,"Why Gaganyaan matters, what its success will mean for Indian science",https://drive.google.com/file/d/1gOrmYIPmx34j46sTDJIbNnxb_lDvjQeO/view?usp=drivesdk,"[""Amitabh Sinha""]"
16_03_2024_31,"On politics, why AI platforms self-censor",https://drive.google.com/file/d/1lYSN831YpMCSUqVLb_t6r9vVDxNEd92y/view?usp=drivesdk,"[""Soumyarendra Barik""]"
16_03_2024_32,"AI, elections, disinformation",https://drive.google.com/file/d/1uYkXp6aJG02qeK-GMBAOmrXDC2PTpzT2/view?usp=drivesdk,"[""Anil Sasi""]"
16_03_2024_33,Looking to the future on St. Patrick's Day,https://drive.google.com/file/d/1xnXxplIw6WlPTX1DnNqCZNYnESB35FTQ/view?usp=drivesdk,"[""Kevin Kelly""]"
16_03_2024_34,It's `Ra-Ra-Ras-Putin' in the Russian election,https://drive.google.com/file/d/1cE8pwZOFECiwhtQJFddKFtMyIf0kKtyk/view?usp=drivesdk,"[""Amitabh Singh"", ""Ankur Dixit""]"
16_03_2024_35,The crime that enraged Puducherry,https://drive.google.com/file/d/1QTPhb792gxPTBQfR5HYuEjgxDhJIGEfJ/view?usp=drivesdk,"[""Rajesh B Nair""]"
16_03_2024_36,How far can AI-aided human creativity be stretched?,https://drive.google.com/file/d/13TMfZSya0SL58GSqHvNHCGtJSs_lDIun/view?usp=drivesdk,"[""Atanu Biswas""]"
16_03_2024_37,Thermal power is here to stay,https://drive.google.com/file/d/1-1vDzePsKUE9h9-rLasf9kEn6epbop2S/view?usp=drivesdk,"[""Richa Mishra""]"
16_03_2024_38,Do celebrities make good politicians?,https://drive.google.com/file/d/12cmkD-LRcvcdG1sNNP2JZRJsIwDV9e3J/view?usp=drivesdk,"[""Sandeep Goyal""]"
16_03_2024_39,CAA: A fading story,https://drive.google.com/file/d/1JlJJpWubP2C0Z3IHYADsTDH2F2xqw8oO/view?usp=drivesdk,"[""Shekhar Gupta""]"
16_03_2024_40,What soft landing?,https://drive.google.com/file/d/1VIbkXmhFSroLftBp5cu8O61VpCxj0ia0/view?usp=drivesdk,"[""Michael R Strain""]"
16_03_2024_41,This could be a global year of the farmer,https://drive.google.com/file/d/1HhM8vyFkXhGgwMewm6LYlJHh9QRIEHCQ/view?usp=drivesdk,"[""Kajal Basu""]"
16_03_2024_42,The curious case of Mayawati and the Dalit vote,https://drive.google.com/file/d/1aBbMDILHKmCc5sFtbKHvXf_YgjnwsH-U/view?usp=drivesdk,"[""Radhika Ramaseshan""]"
16_03_2024_43,Farmers' protests a testimony to flawed market economy,https://drive.google.com/file/d/1K8XdJVqfIUzSq71r4p48lJ4igJr-fMVY/view?usp=drivesdk,"[""Devinder Sharma""]"
16_03_2024_44,Putin's nuke threat sends the West into a huddle,https://drive.google.com/file/d/1_ylHN2VjluXXKorQM_zvpgFTwm10Rjn5/view?usp=drivesdk,"[""Maroof Raza""]"
16_03_2024_45,"At Oscars, a reiteration of American exceptionalism",https://drive.google.com/file/d/1lEAluIFPj4cNvXPyiu0-4CZ59DS4tVAI/view?usp=drivesdk,"[""Nishtha Gautam""]"
16_03_2024_46,Conflict of interest built into the idea of electoral bonds,https://drive.google.com/file/d/1C0-0dvkD_F3twKayJwq49GYO-qv96LH5/view?usp=drivesdk,"[""Barkha Dutt""]"
17_03_2024_1,Cannot afford tiger safari in Corbett core area,https://drive.google.com/file/d/1YnpcOmlDdg2bu2IN3-2_LzJHv1Jf_kzx/view?usp=drivesdk,"[""B K Singh""]"
17_03_2024_2,"SCS: old battleground, new twist",https://drive.google.com/file/d/1ZIGTpdsK6hpbaWzXiMF_gxAqLBiH7pIq/view?usp=drivesdk,"[""Makhan Saikia""]"
17_03_2024_3,Looking East- II,https://drive.google.com/file/d/1wvjyUbbDNzuPYYWEFO1R-AMGREuJnxYh/view?usp=drivesdk,"[""Rajaram Panda""]"
17_03_2024_4,Risk an opportunity for the brave,https://drive.google.com/file/d/1cVZIJjX-LNB6q5i9EQlahrHk018ELSBE/view?usp=drivesdk,"[""Andrew Sheng""]"
