serial no,title,link,author
22_03_2024_47,Getting to the bottom of the bonds,https://drive.google.com/file/d/1KfBEkoi-1dp1eJJQQXUQ64xIR0tpN2N2/view?usp=drivesdk,"[""Julio Ribeiro""]"
22_03_2024_48,Bhagat Singh's revolutionary thinking more relevant than ever,https://drive.google.com/file/d/1X0SwUrtWrCoa9w6UHJxYNDOQy2OO99yq/view?usp=drivesdk,"[""S Irfan Habib""]"
22_03_2024_49,Trump vs Biden: democracies can be fickle making critical choices,https://drive.google.com/file/d/1SdC_8YGy7jHE_zOsbFcdpcbCyu5-1Mif/view?usp=drivesdk,"[""Bhopinder Singh""]"
22_03_2024_50,Global churn ahead: more polls loom after Putin win,https://drive.google.com/file/d/15R5mNn8g5aFqxAiDhOdIjhQcoocEmfTA/view?usp=drivesdk,"[""K C Singh""]"
22_03_2024_51,The dawn of India 3.0- a global powerhouse,https://drive.google.com/file/d/19C1_SzrL8kNhg7DmbjNhaydgOZ0CKghg/view?usp=drivesdk,"[""Yash Goyal"", ""Avnee Byotra""]"
22_03_2024_52,Echoes of resilience: The Hindu and Armenian journey,https://drive.google.com/file/d/1DElTIvDf7MAfBjp7qqzm5DbVOML0Y8OM/view?usp=drivesdk,"[""Arunansh B Goswami"", ""Sumit Kaushik""]"
23_03_2024_1,"The CAA, Muslim exclusion and the lens of the right",https://drive.google.com/file/d/1LTGUsqYr5_Yl0RWe0SUhCxFiFnrUKono/view?usp=drivesdk,"[""Shaikh Mujibur Rehman""]"
23_03_2024_2,"Two wars, the consequences for America's standing",https://drive.google.com/file/d/1HmsLofpGzMOkp_bHIAWCf-VoYwo6DWGg/view?usp=drivesdk,"[""Manoj Joshi""]"
23_03_2024_3,A weather forecast for a better future,https://drive.google.com/file/d/1PgnbgtThSMea9QTfSJWr-cYDABQr6aXw/view?usp=drivesdk,"[""Mrutyunjay Mohapatra"", ""Caitlin Wiesen""]"
23_03_2024_4,Simple solutions to water crisis,https://drive.google.com/file/d/1uFyWd_i3qWmHfbsY0-x1S25GTZCjpo16/view?usp=drivesdk,"[""G Ramkumar"", ""Suresh Mony""]"
23_03_2024_5,`Greatness' need not mean fame and size,https://drive.google.com/file/d/1kc1u1i9SlCCNXfpNi4uBUfTBIxaXpD76/view?usp=drivesdk,"[""R Gopalakrishnan""]"
23_03_2024_6,Political funding's troubling sinkhole,https://drive.google.com/file/d/1w5mNc8-7xeGL-GIP8rGBxODLWMS9L9Z_/view?usp=drivesdk,"[""Devangshu Datta""]"
23_03_2024_7,The idea of Kejriwal,https://drive.google.com/file/d/1UNgj7I1bH9rBRbkkC2OEzv3SBt7F9TL8/view?usp=drivesdk,"[""Shekhar Gupta""]"
23_03_2024_8,Nakabandi safeguards needed for Digital India,https://drive.google.com/file/d/1lZZ1LU5-y_jEHsn4C17YkP1Psmq19BbQ/view?usp=drivesdk,"[""Amandeep Singh Kapoor""]"
23_03_2024_9,Punishment for praying is against India's ethos,https://drive.google.com/file/d/1cKYa2Bi9hgVnw8fyyDYYUbfic_cLXSVz/view?usp=drivesdk,"[""Furqan Qamar""]"
23_03_2024_10,Nations united and divided by the Durand Line,https://drive.google.com/file/d/1uKGOvULf_mfMp-Xj1QvM9skB5om8vWsy/view?usp=drivesdk,"[""Sharat Sabharwal""]"
23_03_2024_11,Shootout at Versova,https://drive.google.com/file/d/11_ZAEH9UMdugTBTdqyNSXUA5_MHLpc-t/view?usp=drivesdk,"[""Mohamed Thaver"", ""Sadaf Modak""]"
23_03_2024_12,The dream chasers who got inducted into a war,https://drive.google.com/file/d/1XKZBkcIpHKaII6JFdwQJ7veIsIy5QcQr/view?usp=drivesdk,"[""Vijaita Singh""]"
23_03_2024_13,Notes of dissonance,https://drive.google.com/file/d/1tGi0jbHuiEp75TtE-0-c_So46qS4aKGV/view?usp=drivesdk,"[""E P Unny""]"
23_03_2024_14,A chilling moment,https://drive.google.com/file/d/1bhsISToK9V5T5a1fgCqmTCnZUvBdMEpw/view?usp=drivesdk,"[""Pratap Bhanu Mehta""]"
23_03_2024_15,"Who pays, who wins",https://drive.google.com/file/d/1u0pz2JXfjZJ06I5GQXFgI3EbTuvUrgOy/view?usp=drivesdk,"[""Brinda Karat""]"
23_03_2024_16,The bogey of political vendetta,https://drive.google.com/file/d/1Tf7oatSP788sMeHhL2IcEj_QsHMVpNTM/view?usp=drivesdk,"[""Manoj Tiwari""]"
23_03_2024_17,A narrow resolution,https://drive.google.com/file/d/1_I-O5p-TXF2Vcli1hvPih-KeCJuiGU8A/view?usp=drivesdk,"[""Ram Madhav""]"
23_03_2024_18,"Pakistan's Taliban problem, on either side of the Afghanistan border",https://drive.google.com/file/d/1EtgU430ZjLkTN8selpwFJxfTKrzMtq70/view?usp=drivesdk,"[""Shubhajit Roy""]"
23_03_2024_19,"Relevant to case: predicate offence, proceeds of crime",https://drive.google.com/file/d/1ERWvPD0UPIZy_1JTxiNtBED7A-RWlRxo/view?usp=drivesdk,"[""Apurva Vishwanath""]"
23_03_2024_20,Allegations against Kejriwal,https://drive.google.com/file/d/1DNBcox87jo9g4WTu-RPFG0EL_4ESBFq4/view?usp=drivesdk,"[""Anonymous""]"
23_03_2024_21,"Gulaal Gota: a beautiful, unique holi tradition of Jaipur",https://drive.google.com/file/d/142pz1LE4BY8dLJeqFqpYqWlWWcw7G5-X/view?usp=drivesdk,"[""Parul Kulshrestha""]"
23_03_2024_22,Powering India's future,https://drive.google.com/file/d/1uAE5ze24ERllwxWXXJABF-P1tIiZTg-I/view?usp=drivesdk,"[""Amit Kapoor""]"
23_03_2024_23,Erratic AI robots,https://drive.google.com/file/d/1Is44p5h5lE4LbcxtqnvJjQTpB5_4qdXN/view?usp=drivesdk,"[""Atanu Biswas""]"
23_03_2024_24,Fifty shades of electoral bonds,https://drive.google.com/file/d/15g8Kgj0sjsuGsgLCbz3tsali5HVHDxKa/view?usp=drivesdk,"[""Madhavan Narayanan""]"
23_03_2024_25,A caring hand for those living on the spectrum,https://drive.google.com/file/d/17s5uWF3P-HIvtCPRJckpbWglALIA2gcw/view?usp=drivesdk,"[""K M Chandrasekhar""]"
23_03_2024_26,Clean air good for body'n'business,https://drive.google.com/file/d/1ajoGiFmfo4Aa9eFa9PGONIQa-XUobTuM/view?usp=drivesdk,"[""Bharati Chaturvedi""]"
23_03_2024_27,Add glitter of trust to households,https://drive.google.com/file/d/1yvQT4S2rH-Zh5sKYpc2xfXP4nc8AHS7I/view?usp=drivesdk,"[""John Muthoot""]"
23_03_2024_28,Marketing ethno-marketing,https://drive.google.com/file/d/11TTdmHIEfLBpnIrD6pRycYRqDbIhfKRr/view?usp=drivesdk,"[""Shivaji Dasgupta""]"
23_03_2024_29,What Kejriwal's arrest does not mean,https://drive.google.com/file/d/1WUcC1tiUOeYoMxi3Pde8o6YvXufE5SfP/view?usp=drivesdk,"[""R Jagannathan""]"
23_03_2024_30,India's young and India's Gods,https://drive.google.com/file/d/1nyb8XpjSTV-rW_l2G4_dVD-UhXsZd-5j/view?usp=drivesdk,"[""Dipankar Gupta""]"
23_03_2024_31,Shifting alliances and tensions in South Asia,https://drive.google.com/file/d/1PH2U7utZlOF71iYqrxoKP7IP83PWicNS/view?usp=drivesdk,"[""Sulagna Mohanty""]"
23_03_2024_32,Shadow of World War III?,https://drive.google.com/file/d/1aGiVntSFX5b4g2ZlrFCL4U1MqSYwVZmJ/view?usp=drivesdk,"[""Hiranmay Karlekar""]"
23_03_2024_33,Empowering India's Gen Z: shaping the future of democracy,https://drive.google.com/file/d/1vRViTw05B73ls7OEHZCjk6u9cEr5PVSY/view?usp=drivesdk,"[""Kirti Dimple""]"
23_03_2024_34,Enigmatic dilemma of Katchatheevu,https://drive.google.com/file/d/1otUsrXlR2TjgF0tuyWvgfeOLFXs4sr1m/view?usp=drivesdk,"[""Santosh Mathew""]"
23_03_2024_35,The devil is in the timing of ED action,https://drive.google.com/file/d/1GIXqp7R9frY_eeS-ZRRvP8bIOX-DGyXI/view?usp=drivesdk,"[""Rajesh Ramachandran""]"
23_03_2024_36,Bonded favours,https://drive.google.com/file/d/1Y_8Re7KxW_wVFNbZLcoLA0kPwiVfHEIa/view?usp=drivesdk,"[""Zoya Hasan""]"
23_03_2024_37,Playing field still uneven,https://drive.google.com/file/d/1MNX9K-k2pdCQdCnfVx3ErpyBqiXnXDsT/view?usp=drivesdk,"[""Aunindyo Chakravarty""]"
23_03_2024_38,Re-igniting the NE,https://drive.google.com/file/d/1I6MnFeHzm_AFERxnM_AOD97g45OCT0fW/view?usp=drivesdk,"[""Renjith Ramachandran"", ""Amarendu Nandy""]"
23_03_2024_39,Why fifty is the new forty,https://drive.google.com/file/d/1U1CLJEnua5zqYQhixB9VWKyIPWDnrCG3/view?usp=drivesdk,"[""Mohsin Fareed""]"
23_03_2024_40,Contest for influence,https://drive.google.com/file/d/1S9QGRRrgEVknf7P04tQ6INK0ZvDp4ReY/view?usp=drivesdk,"[""Jabin T Jacob""]"
23_03_2024_41,India to host 3 of 10 most populated cities in 2050: study,https://drive.google.com/file/d/1Rdb947tuzEIqEuk_62-ESmlUTOncU2DC/view?usp=drivesdk,"[""Anonymous""]"
23_03_2024_42,India's adoption trends show a shift towards gender equality,https://drive.google.com/file/d/1OPLF911a1Bc7XAjOx5LlPfuPzFPY2koU/view?usp=drivesdk,"[""Anonymous""]"
23_03_2024_43,Departure from regimes mired in graft to welfare govt,https://drive.google.com/file/d/1Bw4xdxvv_u20gk-vRUlcllLgNLXx0bkz/view?usp=drivesdk,"[""Avinash Rai Khanna""]"
23_03_2024_44,Iftars now out of fashion in Delhi,https://drive.google.com/file/d/12_8wLlSMVRfBUnLwjZA8xA94CPcVaczD/view?usp=drivesdk,"[""Rasheed Kidwai""]"
23_03_2024_45,Trump vs Biden: Democracies can be fickle making critical choices,https://drive.google.com/file/d/1JwEshGXu-azcsydFRLS9ux_-uFZQwClq/view?usp=drivesdk,"[""Bhopinder Singh""]"
23_03_2024_46,Global churn ahead: More polls loom after Putin win,https://drive.google.com/file/d/1hEHt6D9KdTvmGh77ZLaysdtNEADxx5so/view?usp=drivesdk,"[""K C Singh""]"
24_03_2024_1,AI helps classify neem fruits based on azadirachtin content,https://drive.google.com/file/d/1qiDQ4M7E0NoZsRmsIXPCVpbIMaXUS2U5/view?usp=drivesdk,"[""Anonymous""]"
24_03_2024_2,Anaemia prevalence in eight states found to be overestimated,https://drive.google.com/file/d/1XIBMH7oeBDY5J_tZGu9fJh65jUwhcII3/view?usp=drivesdk,"[""R Prasad""]"
24_03_2024_3,Why is DGCA firm on new rest rules for pilots?,https://drive.google.com/file/d/1Mvj0_NaikJ25U2_IV7UsqGeZFSj997iy/view?usp=drivesdk,"[""Jagriti Chandra""]"
24_03_2024_4,Who may vote from home in LS elections?,https://drive.google.com/file/d/1FkYVT4VnwYaFwqTdK-d68QGzsSZrpz0f/view?usp=drivesdk,"[""Saumya Kalia""]"
24_03_2024_5,How bad is the humanitarian crisis in Gaza?,https://drive.google.com/file/d/1zLBSK7GW4xjUElY3JXc0W4nqxJKCGRpj/view?usp=drivesdk,"[""Stanly Johny""]"
24_03_2024_6,Women are leading the fight against TB,https://drive.google.com/file/d/1l6CLK1t2FSXqAi2g3K8CXQRgOpalxq9I/view?usp=drivesdk,"[""Lalita Panicker""]"
24_03_2024_7,"Once upon a time in Reni, the flagbearers of Chipko",https://drive.google.com/file/d/1CZAlrQmmOFZB6m7XELXz8z7Lih50yoXl/view?usp=drivesdk,"[""Shekhar Pathak""]"
24_03_2024_8,Anna Magdalena's years of solitude in Gabo's voice,https://drive.google.com/file/d/1_Z1xMce3kgx66wb7APWDrCPEAgeCHuEV/view?usp=drivesdk,"[""Damodar Prasad""]"
24_03_2024_9,The story of Usha Mehta and Congress Radio,https://drive.google.com/file/d/13Pa46uhuTjjjebkoFJBy6lNEhLniv0vH/view?usp=drivesdk,"[""Arjun Sengupta""]"
24_03_2024_10,The soup kitchen,https://drive.google.com/file/d/12123x3EMv5tpe4iEviAgORvH_oNH7Ah9/view?usp=drivesdk,"[""P Chidambaram""]"
24_03_2024_11,Weaving a circular economy of textile,https://drive.google.com/file/d/1erjWYK8Tw1pADtr1UOqluNCtW8ZCC9yb/view?usp=drivesdk,"[""Geetha Ravichandran""]"
24_03_2024_12,An arrest and a political riddle,https://drive.google.com/file/d/1yzFzNunazqZ_lfzmvF0sxhwaCPyCxuqf/view?usp=drivesdk,"[""Santwana Bhattacharya""]"
24_03_2024_13,CAA- Passport to freedom,https://drive.google.com/file/d/1l3y2g24sKBQxTaA_KfWm06Q44onhmjwm/view?usp=drivesdk,"[""Kumar Chellappan""]"
24_03_2024_14,"Writers, honour and awards",https://drive.google.com/file/d/1naCRjMsNt8dsauQz95925aqlPtyI5nHz/view?usp=drivesdk,"[""G J V Prasad""]"
24_03_2024_15,Immerse yourself in the vibrant colours of Holi,https://drive.google.com/file/d/1s36-REsWOzV35MqIZd6vanD8PEuiGaM7/view?usp=drivesdk,"[""Sheo Shekhar Shukla""]"
24_03_2024_16,Interconnected narrative,https://drive.google.com/file/d/1hfv0xcPMsnk1PD1q9jEYXR4TQjQvTeQz/view?usp=drivesdk,"[""B K P Sinha"", ""Arvind K Jha""]"
24_03_2024_17,Case for Mango Board,https://drive.google.com/file/d/1EiZ7Oru4rvd04p9U8SDe98rMQ19I9RMv/view?usp=drivesdk,"[""K S S Seshan""]"
24_03_2024_18,Digital recreates the social: what `pure veg' fleet says about caste,https://drive.google.com/file/d/1CRgkd5eILtnWbsjSYJd3krWQEQ1genbh/view?usp=drivesdk,"[""Rituparna Patgiri""]"
24_03_2024_19,"As US states consider age-gating social media, India should ponder curbs too",https://drive.google.com/file/d/10EEY8M5NmJ_8TElQxcZL3XHx2Wx1EQXR/view?usp=drivesdk,"[""Chetan Bhagat""]"
24_03_2024_20,A Delhi conundrum,https://drive.google.com/file/d/1VKF5739LkdGrm88mlB3vL0YFlI8PprBH/view?usp=drivesdk,"[""Devender Singh Aswal""]"
24_03_2024_21,A global state of disunion,https://drive.google.com/file/d/1xcHkSaYm-GY9dWEKEVbgq7MHuKRL5ujy/view?usp=drivesdk,"[""Andrew Sheng""]"
24_03_2024_22,The odd G out,https://drive.google.com/file/d/12PoK41tH6xw3YGh7wQ50qrBOFm1CbKtA/view?usp=drivesdk,"[""Kalyan Parbat""]"
24_03_2024_23,Voice of pod,https://drive.google.com/file/d/1PBEL85SHQgjOY-axoeMXHq-hBLleeseS/view?usp=drivesdk,"[""Apoorva Mittal""]"
24_03_2024_24,Makeover of business administration,https://drive.google.com/file/d/1jm_F65xJBTYZOeBLnIfe_4yRuxGdqcAg/view?usp=drivesdk,"[""Sreeradha D Basu"", ""Saumya Bhattacharya""]"
24_03_2024_25,"Zo, Zomato, Nice Quick u-turn before you ended up unleashing veg vigilantes",https://drive.google.com/file/d/1jcy3Jshddc-qhgILKdpOELIZsMbNHemr/view?usp=drivesdk,"[""Rajyasree Sen""]"
24_03_2024_26,Searching for Google,https://drive.google.com/file/d/14sEXfbL1QcbZpkmi_5ZCP3cLijfboo4i/view?usp=drivesdk,"[""Dia Rekhi""]"
24_03_2024_27,Putin's tyranny only fortified by Russophobia of Western powers,https://drive.google.com/file/d/1Or8CVtYRt7HOwAzYpOY6ExjDxayDgZMI/view?usp=drivesdk,"[""Mahir Ali""]"
24_03_2024_28,Don't be in haste to curtail parliamentary privileges,https://drive.google.com/file/d/1emlFPebUh2QirAXAzBjHdStviv9cwnE5/view?usp=drivesdk,"[""Manish Tewari""]"
25_03_2024_1,Actionable ideas for TB control,https://drive.google.com/file/d/1ORa35QprtCLmuT4o1b89sgNeU8UQAPCg/view?usp=drivesdk,"[""Aruna Bhattacharya""]"
25_03_2024_2,TB control in India calls for person-centred solutions,https://drive.google.com/file/d/1tu7dwSafvh82kiv9w_damnhHQ7LmllPk/view?usp=drivesdk,"[""Soumya Swaminathan"", ""Chapal Mehra""]"
25_03_2024_3,The right diagnosis for tuberculosis,https://drive.google.com/file/d/18ElA8ez09p1lD0Tp8pVwPgo8xvHlI_mm/view?usp=drivesdk,"[""Sarabjit Chadha""]"
25_03_2024_4,What are the new rules for elephant transfers?,https://drive.google.com/file/d/1jvUJU0WkrS0tKwuFBzTcILeo01lqQ8Qg/view?usp=drivesdk,"[""Jacob Koshy""]"
25_03_2024_5,On the resurgence of mumps in Kerala,https://drive.google.com/file/d/1GRmS7cD4F_HrLW4hTVU4mhFmmBf0Gv26/view?usp=drivesdk,"[""C Maya""]"
25_03_2024_6,Digital financial frauds in India: a call for improved investigation strategies,https://drive.google.com/file/d/1Ih9H1-RQFrw-pUSKF65dHSxIkNvKMI5q/view?usp=drivesdk,"[""Bharat Reddy""]"
25_03_2024_7,Need to brace for high cost of public debt,https://drive.google.com/file/d/1nHHiUXv95qvjo0Erh58Kdu_K7hNWJVYj/view?usp=drivesdk,"[""Rajani Sinha""]"
25_03_2024_8,Export of Vande Bharat trains on the right track,https://drive.google.com/file/d/1cuUwGGT9A1iGBme9RYcjTsDi3wpAllqY/view?usp=drivesdk,"[""Sudhanshu Mani""]"
25_03_2024_9,Electoral bonds: Where are the disclosures?,https://drive.google.com/file/d/14_ZVtpjZEIRf9h5omFlrV-lLDGxK_jFw/view?usp=drivesdk,"[""Debashis Basu""]"
25_03_2024_10,A short report card,https://drive.google.com/file/d/135LZmVp3O_vNtA7T4xMQQoxuK5mFNpKD/view?usp=drivesdk,"[""Mihir S Sharma""]"
25_03_2024_11,Who stands to gain from anti-corruption politics?,https://drive.google.com/file/d/1E4sNbUM1Cdl5U3S6ZQdaaRuO5bhBPqZp/view?usp=drivesdk,"[""Shashi Shekhar""]"
25_03_2024_12,UP's journey towards a trillion-dollar economy,https://drive.google.com/file/d/1ceg0YZ3A0WqE6_Gp29QPgcDbfCMPawlv/view?usp=drivesdk,"[""Yogi Adityanath""]"
25_03_2024_13,Anticipating Biden versus Trump rerun,https://drive.google.com/file/d/1SOBAs1Q_AESeNtMXpO2xu2e402k3HAHk/view?usp=drivesdk,"[""Dhruva Jaishankar""]"
25_03_2024_14,Why the arrest of Kejriwal may have big consequences,https://drive.google.com/file/d/1kAomK6N3zcSKrfAXzod0JlD8meZ8w84V/view?usp=drivesdk,"[""Manu Joseph""]"
25_03_2024_15,Apple Inc: A victim of its own digital revolution?,https://drive.google.com/file/d/1w1fi3eaBmOTVn1a8uH8HRXaCAU8tavv_/view?usp=drivesdk,"[""Anonymous""]"
25_03_2024_16,The West's disregard for global norms is endangering the world,https://drive.google.com/file/d/1-qxAZWWeaQXalEsmEtQufyKV0mEMnNok/view?usp=drivesdk,"[""Nitin Pai""]"
25_03_2024_17,Trust could be the cornerstone for this election season,https://drive.google.com/file/d/1EziudcFSp1e4Qpu3ovdfAEsdJVW_MNkY/view?usp=drivesdk,"[""Rajrishi Singhal""]"
25_03_2024_18,We should listen to the Global South's outcry on the Gaza war,https://drive.google.com/file/d/1rdQ73-6E6Ql9bvfuoon_LCESo2tGenlA/view?usp=drivesdk,"[""Karishma Vaswani""]"
25_03_2024_19,Minimally disrupted schooling can reduce high drop-out rates,https://drive.google.com/file/d/1Z3jSekDb1go4OfVkQAK10IzcfN5MeVlq/view?usp=drivesdk,"[""Bibek Debroy"", ""Sanjay Kumar"", ""Aditya Sinha""]"
25_03_2024_20,WTO's existential crisis,https://drive.google.com/file/d/1AlvcKkB43-WHh8GnWj6ZnsByFq_Ybrf0/view?usp=drivesdk,"[""Prabhash Ranjan""]"
25_03_2024_21,Opposition-mukt election?,https://drive.google.com/file/d/1KdxdryoNSEGLYFr-F8cKyZEd4rV3qkJ4/view?usp=drivesdk,"[""Suhas Palshikar""]"
25_03_2024_22,Don't browbeat the court,https://drive.google.com/file/d/1kSPXYyWvnPyJKhEHtGpv3Qa0aXU-2TeO/view?usp=drivesdk,"[""Hitesh Jain""]"
25_03_2024_23,Taste of discrimination,https://drive.google.com/file/d/13k6Pb902bRDyJ04j6qJoTRnVkW-BaPfb/view?usp=drivesdk,"[""Shivani Kapoor""]"
25_03_2024_24,How AAP lost its way,https://drive.google.com/file/d/1NT4_buPwFPNjEWbLYrFZt5nBpzdfAC-P/view?usp=drivesdk,"[""Ashutosh""]"
25_03_2024_25,"Water crisis in Karnataka, reservoir levels worrying in many places",https://drive.google.com/file/d/1c4lnYNMMYIy47sK_R7_YlZ4c2ZWTbgDT/view?usp=drivesdk,"[""Anjali Marar""]"
25_03_2024_26,Holi is becoming warmer than before: what a new study says,https://drive.google.com/file/d/1YrHY63OPf9deuj8xfa2fm1u5g7upnbhW/view?usp=drivesdk,"[""Alind Chauhan""]"
25_03_2024_27,Pak's basmati seed `piracy',https://drive.google.com/file/d/1mjdkMZiHeTPv5vzIEEHB52gK6aTk-G7r/view?usp=drivesdk,"[""Harish Damodaran""]"
25_03_2024_28,The devil is in the details,https://drive.google.com/file/d/1sTG85ahgWRdNDrrUOuQc4aJyo9jOELWo/view?usp=drivesdk,"[""Jayati Ghosh""]"
25_03_2024_29,EVs will drive us into 2030,https://drive.google.com/file/d/1HBr8mtgHvoA0lEi_RfHdrt5QjNUidxhQ/view?usp=drivesdk,"[""Jyoti Malhotra""]"
25_03_2024_30,What 2 arrests reveal about our democracy,https://drive.google.com/file/d/1FznstjAVREiWBi3xjQBWkzdukpWyG1yR/view?usp=drivesdk,"[""Kipal Sibal""]"
25_03_2024_31,"Prioritise, don't tick all boxes",https://drive.google.com/file/d/1deZwGKILUIQ0AGKEerjPNQlKUYQwk9hS/view?usp=drivesdk,"[""Kodjo E Mensah-Abrampa"", ""Thomas C Munthali"", ""Bjorn Lomborg""]"
25_03_2024_32,"Too much tough love, guv?",https://drive.google.com/file/d/1f0Yc-T3bkT6B1ecc5afuI8-I5oedqykY/view?usp=drivesdk,"[""Ateesh Tankha"", ""Ganga Narayan Rath""]"
25_03_2024_33,`Who decides what core values of nationalism are? Is dialogue possible or is it all exclusive?',https://drive.google.com/file/d/1CRJtcHLdU0_Df4pXn99CqzAE-ddakhOn/view?usp=drivesdk,"[""Carola Lentz"", ""Narayani Ganesh""]"
25_03_2024_34,"Holi, IPL, elections",https://drive.google.com/file/d/1NBR6Z-96qY2XW05RhWlVfrqHGqcj06EV/view?usp=drivesdk,"[""Santosh Desai""]"
25_03_2024_35,Life's palette: colours to illuminate existence,https://drive.google.com/file/d/1mUsv2Dp1Ot62i4sNIdzRtZyL45tYa4u1/view?usp=drivesdk,"[""Harish Barthwal""]"
25_03_2024_36,Zero-water day is nigh in Bengaluru,https://drive.google.com/file/d/1ZxAcyZfK8mwdlXbAlqEEZJ7DRjTcI2Gc/view?usp=drivesdk,"[""Kota Sriraj""]"
25_03_2024_37,The golden hour: timely response in medical emergencies,https://drive.google.com/file/d/1JlbVSv1WXs5yb5W-Pebuum2kfc7jWRwe/view?usp=drivesdk,"[""Sarika Jha""]"
25_03_2024_38,Debunking claims of fiscal discrimination,https://drive.google.com/file/d/1UlY5JFHmEy89NCi02rF2ZGXlVr_zm58w/view?usp=drivesdk,"[""Uttam Gupta""]"
25_03_2024_39,What to expect from Putin's new term,https://drive.google.com/file/d/11kDgCr0j9iKkAKifi1xd7H_2o_Wr5D9T/view?usp=drivesdk,"[""K P Nayar""]"
25_03_2024_40,China losing economic heft amid widespread trust deficit,https://drive.google.com/file/d/1uDoSyx4p1B7Z6sq_1vMJxRq9CajlAqZd/view?usp=drivesdk,"[""Yogesh Gupta""]"
25_03_2024_41,Make couples aware of risks involved in IVF,https://drive.google.com/file/d/1hxC9jf6YBRxkD9jowzlY_zVSvJ18iTQM/view?usp=drivesdk,"[""Shailaja Chandra""]"
25_03_2024_42,Elections and the Public,https://drive.google.com/file/d/1bl04tS0cyqfk25y885tNQCXTVf-sPB0W/view?usp=drivesdk,"[""Devendra Saksena""]"
25_03_2024_43,Voters force US to change rhetoric on Gaza war: Will policy follow suit?,https://drive.google.com/file/d/1RbN7_djYpFAtkJ6D9sE2OTYeVFGvUroe/view?usp=drivesdk,"[""Rafia Zakaria""]"
25_03_2024_44,Kejriwal arrest: Will it help BJP get political advantage?,https://drive.google.com/file/d/1DSv2snj5OodrZHg1Sif5oE8H3_aSuWrQ/view?usp=drivesdk,"[""Parsa Venkateshwar Rao Jr""]"
25_03_2024_45,Why South Korea's democrats must worry,https://drive.google.com/file/d/1BcO-GDfevU16zpyV3jeY9QEkKZVJpAMa/view?usp=drivesdk,"[""Wang Son-Taek""]"
25_03_2024_46,Had media turned pollutant to misreport Guwahati?,https://drive.google.com/file/d/16_qI6owwQXeBPuNTUsXzIwVGKq54rR59/view?usp=drivesdk,"[""Nava Thakuria""]"
25_03_2024_47,Drive Defence with startups,https://drive.google.com/file/d/1zGH4nZXIkhXk2q5wPWbTxKDbNIPhoQMN/view?usp=drivesdk,"[""Viiveck Verma""]"
25_03_2024_48,Changing dynamics of threat,https://drive.google.com/file/d/1N3PAwtLNdchfrOdrrw4gSWwoyK-h9wL0/view?usp=drivesdk,"[""Shibdas Bhattacharjee""]"
25_03_2024_49,MMR housing market surges despite rising property prices,https://drive.google.com/file/d/1l95ysX2gaFkXhuebWE2zhXJT0hhF1yK2/view?usp=drivesdk,"[""Anonymous""]"
25_03_2024_50,Battling world's 2nd leading cause of infectious disease deaths,https://drive.google.com/file/d/1q12U_lm0m0sHuUPR6fGRsH1SUfDRClMq/view?usp=drivesdk,"[""Anonymous""]"
25_03_2024_51,Curvy paths to publishing,https://drive.google.com/file/d/1vIDk7iXxf1fsH7stS89MB8BkHSRVOoig/view?usp=drivesdk,"[""Sagar Azad""]"
25_03_2024_52,Maldives in China's Shadow?,https://drive.google.com/file/d/15WrZeDBBoY78ZHdOMLKahJ065UQL8Xre/view?usp=drivesdk,"[""Girish Linganna""]"
26_03_2024_1,"China, a `want-to-be' superpower",https://drive.google.com/file/d/1jtqoC7dwTuEu6TpZ5zegzM94Ash2lZXk/view?usp=drivesdk,"[""Kabir Taneja""]"
26_03_2024_2,A dissonant chord in the world of Carnatic music,https://drive.google.com/file/d/1R7G-ZMFUkCGL51046-4C2qldk-uMd6Ir/view?usp=drivesdk,"[""G R Gopinath""]"
26_03_2024_3,Understanding what the right to equality promises,https://drive.google.com/file/d/1zD__3-Mf6A9iGtf3WaNRq95cSWsMCwUf/view?usp=drivesdk,"[""Aditya Phalnikar""]"
26_03_2024_4,What is the district election management plan?,https://drive.google.com/file/d/1Y_Il_tjE_4LSwsTjjm0QedX4sE5ikzEE/view?usp=drivesdk,"[""Ravi Mittal"", ""Rajat Bansal""]"
26_03_2024_5,On campaigning in the name of religion,https://drive.google.com/file/d/1d5jPTjS8q934-8tg6XBDEnblRcSDTCdc/view?usp=drivesdk,"[""Rangarajan R""]"
26_03_2024_6,"On semiconductors: how they are made, used and who manufactures them",https://drive.google.com/file/d/1ljpHmdNxilQoNRlPsA43U14sAFyJ5SxH/view?usp=drivesdk,"[""Awanish Pandey""]"
26_03_2024_7,Moscow terror attack: How worried should we be?,https://drive.google.com/file/d/1J9ANQ1UGcLYgGK591vzemfG_T5RpOkQN/view?usp=drivesdk,"[""R K Raghavan""]"
26_03_2024_8,Leon Walras and the political process,https://drive.google.com/file/d/10AYZ2z2SYea1g_U4xdMm_Fl_Rzn2c4-6/view?usp=drivesdk,"[""T C A Srinivasa Raghavan""]"
26_03_2024_9,China vows to treat foreign firms equally,https://drive.google.com/file/d/1SPZrnzww2AqRlam5II_t5FnL4ban618c/view?usp=drivesdk,"[""Liangping Gao"", ""Ryan Woo"", ""Jing Xu""]"
26_03_2024_10,GST: Boost for businesses,https://drive.google.com/file/d/1-ER_BE0bMPWq9yfm956yJaK7u6gVErj4/view?usp=drivesdk,"[""Chandrajit Banerjee""]"
26_03_2024_11,Japan's unconventional monetary policy gamble,https://drive.google.com/file/d/1xDP4gbZYPCumaMp78grIQy5rluq8zE_u/view?usp=drivesdk,"[""Mridul Sagar""]"
26_03_2024_12,Where is the debt?,https://drive.google.com/file/d/1Jm0jJo9cZE9hLZa1-94Km2O_ifAiWE4w/view?usp=drivesdk,"[""Akash Prakash""]"
26_03_2024_13,India's fight against TB must focus on women,https://drive.google.com/file/d/1IOeyMownuxicfAxV09BL-YWXecSK2mx5/view?usp=drivesdk,"[""Vandana Chavan""]"
26_03_2024_14,"Mukoma wa Ngugi's tale: Weep not, Mother",https://drive.google.com/file/d/1Be5qag4bo7S2FcqPBQcnkwV0yBa6stZ-/view?usp=drivesdk,"[""Anushree Majumdar""]"
26_03_2024_15,A second Trump term and US foreign policy,https://drive.google.com/file/d/1noJeAULpj7P4SwDdPIPbFMFxLX0jC0x9/view?usp=drivesdk,"[""Ian Bremmer""]"
26_03_2024_16,The next wave of co-lending partnerships,https://drive.google.com/file/d/1S_9CIumyyeBzLirxW3pEFjLLdgcDmLFX/view?usp=drivesdk,"[""Alok Mittal""]"
26_03_2024_17,Cybersecurity front and centre,https://drive.google.com/file/d/1ccdLMvFiHVp_Bf7t0B0MSoDASdZlKPSG/view?usp=drivesdk,"[""Siddharth Pai""]"
26_03_2024_18,WTO hobbling when the world needs it,https://drive.google.com/file/d/1587Y_ZS7rnBo2eiGjY-NWn1oUDU560Ui/view?usp=drivesdk,"[""Biswajit Dhar""]"
26_03_2024_19,Living in an era of physical trust vs digital distrust,https://drive.google.com/file/d/1sC2-0FB3PDeJVJ3I2L2BmRjAlQxBfJko/view?usp=drivesdk,"[""Harish Bijoor""]"
26_03_2024_20,SAHI jawab for insurance,https://drive.google.com/file/d/1vB0P1LxRza-ducncvyuziqYiPHVlUr-C/view?usp=drivesdk,"[""Prashant Maheshwari"", ""Chandresh Ruparel""]"
26_03_2024_21,Gig workers aren't bots,https://drive.google.com/file/d/192kLqnkrejaCZ2Dnq776WUttvl8ow-dX/view?usp=drivesdk,"[""Rita McGrath"", ""M Muneer""]"
26_03_2024_22,Carnatic musicians are out of tune,https://drive.google.com/file/d/1MQXa9g--fkgQdRAbl7P25mTFmIcXhbbx/view?usp=drivesdk,"[""Malini Nair""]"
26_03_2024_23,A bridge stranger than any fiction,https://drive.google.com/file/d/1TFqIu_e16D57FqApG5c5Z1JqMd07ds6-/view?usp=drivesdk,"[""Zoru Bhathena""]"
26_03_2024_24,"Dogs understand more than they let on, create mental images",https://drive.google.com/file/d/1kQoUBFWgNqFrXBGfk3vEdrJnznvzpukT/view?usp=drivesdk,"[""Anonymous""]"
26_03_2024_25,"In a surprise vote, major European climate protection plan shelved",https://drive.google.com/file/d/1ecWeeDnQMa9Kqdj0Rlxw9n7Vl3xZw-fF/view?usp=drivesdk,"[""Anonymous""]"
